{"$schema":"https://json-schema.org/draft/2020-12/schema","additionalProperties":false,"properties":{"athlete":{"additionalProperties":false,"properties":{"name":{"minLength":1,"type":"string"}},"required":["name"],"type":"object"},"audit":{"additionalProperties":false,"properties":{"createdAt":{"pattern":"^\\d{4}-\\d{2}-\\d{2}T\\d{2}:\\d{2}:\\d{2}Z$","type":"string"},"sourceRecordId":{"minLength":1,"type":"string"},"updatedAt":{"pattern":"^\\d{4}-\\d{2}-\\d{2}T\\d{2}:\\d{2}:\\d{2}Z$","type":"string"}},"required":["createdAt","updatedAt","sourceRecordId"],"type":"object"},"classicExceptionApprovedBy":{"anyOf":[{"minLength":1,"type":"string"},{"type":"null"}]},"classicProposedBy":{"anyOf":[{"minLength":1,"type":"string"},{"type":"null"}]},"classicReason":{"anyOf":[{"minLength":1,"type":"string"},{"type":"null"}]},"competition":{"additionalProperties":false,"properties":{"code":{"minLength":1,"type":"string"}},"required":["code"],"type":"object"},"eventDate":{"pattern":"^\\d{4}-\\d{2}-\\d{2}$","type":"string"},"general":{"additionalProperties":false,"properties":{"confirmedUpdate":{"minLength":1,"type":"string"},"whatHappened":{"minLength":1,"type":"string"},"whatIsVisible":{"minLength":1,"type":"string"},"whatVideoCannotProve":{"minLength":1,"type":"string"}},"required":["whatHappened","whatIsVisible","whatVideoCannotProve","confirmedUpdate"],"type":"object"},"id":{"pattern":"^CASE-[A-Z0-9]+-[0-9]{4}-[0-9]{3}$","type":"string"},"injury":{"additionalProperties":false,"properties":{"code":{"minLength":1,"type":"string"},"confirmationStatus":{"enum":["unconfirmed","confirmed","conflicted"],"type":"string"},"confirmedDiagnosis":{"minLength":1,"type":"string"}},"required":["code","confirmedDiagnosis","confirmationStatus"],"type":"object"},"isClassic":{"type":"boolean"},"league":{"additionalProperties":false,"properties":{"code":{"minLength":1,"type":"string"}},"required":["code"],"type":"object"},"observedMechanismTags":{"items":{"minLength":1,"type":"string"},"minItems":1,"type":"array"},"opponent":{"additionalProperties":false,"properties":{"name":{"minLength":1,"type":"string"}},"required":["name"],"type":"object"},"professional":{"additionalProperties":false,"properties":{"claims":{"items":{"additionalProperties":false,"properties":{"evidenceIds":{"items":{"minLength":1,"type":"string"},"minItems":1,"type":"array"},"field":{"enum":["professional.mechanismAnalysis","professional.clinicalLimitations","professional.differentialContext","professional.treatmentAndRtpMeaning"],"type":"string"},"id":{"minLength":1,"type":"string"},"text":{"minLength":1,"type":"string"}},"required":["id","field","text","evidenceIds"],"type":"object"},"minItems":1,"type":"array"},"clinicalLimitations":{"minLength":1,"type":"string"},"differentialContext":{"minLength":1,"type":"string"},"evidenceIds":{"items":{"minLength":1,"type":"string"},"minItems":1,"type":"array"},"mechanismAnalysis":{"minLength":1,"type":"string"},"rtpCourseKey":{"anyOf":[{"minLength":1,"type":"string"},{"type":"null"}]},"treatmentAndRtpMeaning":{"minLength":1,"type":"string"}},"required":["mechanismAnalysis","clinicalLimitations","differentialContext","treatmentAndRtpMeaning","claims","evidenceIds","rtpCourseKey"],"type":"object"},"review":{"additionalProperties":false,"properties":{"reviewedAt":{"anyOf":[{"pattern":"^\\d{4}-\\d{2}-\\d{2}T\\d{2}:\\d{2}:\\d{2}Z$","type":"string"},{"type":"null"}]},"reviewedContentDigest":{"anyOf":[{"pattern":"^[0-9a-f]{64}$","type":"string"},{"type":"null"}]},"reviewerName":{"anyOf":[{"minLength":1,"type":"string"},{"type":"null"}]},"reviewerQualification":{"anyOf":[{"minLength":1,"type":"string"},{"type":"null"}]},"status":{"enum":["not-requested","in-review","approved","changes-requested"],"type":"string"}},"required":["status","reviewerName","reviewerQualification","reviewedAt","reviewedContentDigest"],"type":"object"},"schemaVersion":{"const":1,"type":"number"},"season":{"pattern":"^(19|20)[0-9]{2}(-[0-9]{2})?$","type":"string"},"slug":{"pattern":"^[a-z0-9]+(?:-[a-z0-9]+)*$","type":"string"},"sourceManifestBinding":{"additionalProperties":false,"properties":{"candidateId":{"minLength":1,"type":"string"},"entryDigest":{"pattern":"^[0-9a-f]{64}$","type":"string"},"manifestDigest":{"pattern":"^[0-9a-f]{64}$","type":"string"},"manifestId":{"minLength":1,"type":"string"},"sourcePolicyVersion":{"minLength":1,"type":"string"},"sourceReviewDecisionDigest":{"pattern":"^[0-9a-f]{64}$","type":"string"}},"required":["candidateId","manifestId","manifestDigest","entryDigest","sourceReviewDecisionDigest","sourcePolicyVersion"],"type":"object"},"sources":{"items":{"additionalProperties":false,"properties":{"accessedAt":{"pattern":"^\\d{4}-\\d{2}-\\d{2}$","type":"string"},"id":{"minLength":1,"type":"string"},"independenceGroup":{"pattern":"^[a-z0-9]+(?:-[a-z0-9]+)*$","type":"string"},"originReportId":{"anyOf":[{"minLength":1,"type":"string"},{"type":"null"}]},"publishedAt":{"pattern":"^\\d{4}-\\d{2}-\\d{2}$","type":"string"},"publisher":{"minLength":1,"type":"string"},"supports":{"items":{"enum":["general.whatHappened","injury.confirmedDiagnosis","general.whatIsVisible","general.confirmedUpdate","professional.mechanismAnalysis","professional.clinicalLimitations","professional.differentialContext","professional.treatmentAndRtpMeaning","video.segmentObservation"],"type":"string"},"minItems":1,"type":"array"},"title":{"minLength":1,"type":"string"},"type":{"enum":["diagnosis-first-party","diagnosis-secondary","video-original","event-context","teaching-evidence"],"type":"string"},"url":{"pattern":"^https:\\/\\/[^\\s<>\"']+$","type":"string"}},"required":["id","type","title","publisher","independenceGroup","originReportId","url","publishedAt","accessedAt","supports"],"type":"object"},"minItems":1,"type":"array"},"sport":{"additionalProperties":false,"properties":{"code":{"minLength":1,"type":"string"}},"required":["code"],"type":"object"},"status":{"enum":["draft","source-verified","medical-review","approved","rejected","retired"],"type":"string"},"teamAtEvent":{"additionalProperties":false,"properties":{"name":{"minLength":1,"type":"string"}},"required":["name"],"type":"object"},"video":{"additionalProperties":false,"properties":{"canonicalUrl":{"pattern":"^https:\\/\\/[^\\s<>\"']+$","type":"string"},"captionCheckedAt":{"pattern":"^\\d{4}-\\d{2}-\\d{2}T\\d{2}:\\d{2}:\\d{2}Z$","type":"string"},"captionStatus":{"enum":["available","unavailable","not-verified"],"type":"string"},"contentType":{"enum":["in-game-injury-event"],"type":"string"},"durationSeconds":{"maximum":9007199254740991,"minimum":1,"type":"integer"},"embedCheckedAt":{"pattern":"^\\d{4}-\\d{2}-\\d{2}T\\d{2}:\\d{2}:\\d{2}Z$","type":"string"},"embedStatus":{"enum":["verified","external-link-only","unavailable"],"type":"string"},"endSeconds":{"maximum":9007199254740991,"minimum":0,"type":"integer"},"eventBinding":{"additionalProperties":false,"properties":{"basis":{"anyOf":[{"minLength":1,"type":"string"},{"type":"null"}]},"checkedAt":{"anyOf":[{"pattern":"^\\d{4}-\\d{2}-\\d{2}T\\d{2}:\\d{2}:\\d{2}Z$","type":"string"},{"type":"null"}]},"checkedBy":{"anyOf":[{"minLength":1,"type":"string"},{"type":"null"}]},"eventSourceId":{"anyOf":[{"minLength":1,"type":"string"},{"type":"null"}]},"status":{"enum":["pending","verified","rejected"],"type":"string"}},"required":["status","eventSourceId","checkedBy","checkedAt","basis"],"type":"object"},"fallbackUrl":{"pattern":"^https:\\/\\/[^\\s<>\"']+$","type":"string"},"provider":{"minLength":1,"type":"string"},"publicRightsReview":{"additionalProperties":false,"properties":{"decisionBasis":{"anyOf":[{"minLength":1,"type":"string"},{"type":"null"}]},"decisionDigest":{"anyOf":[{"pattern":"^[0-9a-f]{64}$","type":"string"},{"type":"null"}]},"decisionPath":{"anyOf":[{"minLength":1,"type":"string"},{"type":"null"}]},"notes":{"anyOf":[{"minLength":1,"type":"string"},{"type":"null"}]},"policyVersion":{"anyOf":[{"minLength":1,"type":"string"},{"type":"null"}]},"reviewedAt":{"anyOf":[{"pattern":"^\\d{4}-\\d{2}-\\d{2}T\\d{2}:\\d{2}:\\d{2}Z$","type":"string"},{"type":"null"}]},"reviewedBy":{"anyOf":[{"minLength":1,"type":"string"},{"type":"null"}]},"reviewedVideoDigest":{"anyOf":[{"pattern":"^[0-9a-f]{64}$","type":"string"},{"type":"null"}]},"status":{"enum":["not-requested","cleared","rejected"],"type":"string"},"termsCheckedAt":{"anyOf":[{"pattern":"^\\d{4}-\\d{2}-\\d{2}T\\d{2}:\\d{2}:\\d{2}Z$","type":"string"},{"type":"null"}]}},"required":["status","reviewedBy","reviewedAt","reviewedVideoDigest","policyVersion","termsCheckedAt","decisionBasis","notes","decisionPath","decisionDigest"],"type":"object"},"segments":{"items":{"additionalProperties":false,"properties":{"endSeconds":{"maximum":9007199254740991,"minimum":0,"type":"integer"},"observation":{"minLength":1,"type":"string"},"startSeconds":{"maximum":9007199254740991,"minimum":0,"type":"integer"}},"required":["startSeconds","endSeconds","observation"],"type":"object"},"type":"array"},"sourceProvenanceVerification":{"additionalProperties":false,"properties":{"basis":{"anyOf":[{"minLength":1,"type":"string"},{"type":"null"}]},"notes":{"anyOf":[{"minLength":1,"type":"string"},{"type":"null"}]},"reviewedVideoIdentityDigest":{"anyOf":[{"pattern":"^[0-9a-f]{64}$","type":"string"},{"type":"null"}]},"status":{"enum":["pending","verified","rejected"],"type":"string"},"verifiedAt":{"anyOf":[{"pattern":"^\\d{4}-\\d{2}-\\d{2}T\\d{2}:\\d{2}:\\d{2}Z$","type":"string"},{"type":"null"}]},"verifiedBy":{"anyOf":[{"minLength":1,"type":"string"},{"type":"null"}]},"verifiedPolicyVersion":{"anyOf":[{"minLength":1,"type":"string"},{"type":"null"}]}},"required":["status","verifiedBy","verifiedAt","basis","notes","verifiedPolicyVersion","reviewedVideoIdentityDigest"],"type":"object"},"startSeconds":{"maximum":9007199254740991,"minimum":0,"type":"integer"},"uploaderName":{"minLength":1,"type":"string"},"uploaderProvenance":{"minLength":1,"type":"string"}},"required":["provider","contentType","eventBinding","canonicalUrl","uploaderName","uploaderProvenance","embedStatus","embedCheckedAt","durationSeconds","startSeconds","endSeconds","fallbackUrl","sourceProvenanceVerification","captionStatus","captionCheckedAt","publicRightsReview","segments"],"type":"object"}},"required":["schemaVersion","id","slug","status","sourceManifestBinding","sport","league","competition","athlete","teamAtEvent","season","eventDate","opponent","injury","observedMechanismTags","isClassic","classicReason","classicProposedBy","classicExceptionApprovedBy","video","general","professional","sources","review","audit"],"type":"object"}