{
  "schemaVersion": 1,
  "id": "CASE-NBAANKLE-2023-008",
  "slug": "lamelo-ball-ankle-sprain-2023",
  "status": "approved",
  "sourceManifestBinding": {
    "candidateId": "CAND-NBA-ANKLE-2023-008",
    "manifestId": "NBA-SOURCE-2026-08-08-001",
    "manifestDigest": "4a25692e27115b6ec16818a64dd6e85778360e4f00e2b3f6a288b4ca5f0ed0bc",
    "entryDigest": "9d80dc156b44ae0d107c1a34f9cc3a2340ba258f4180426190c7e9b56cef9b69",
    "sourceReviewDecisionDigest": "dd08a891325f384621f61af9dd14084de579a9b5b86ce2cccecff893827d8464",
    "sourcePolicyVersion": "nba-v2"
  },
  "sport": {
    "code": "basketball"
  },
  "league": {
    "code": "nba"
  },
  "competition": {
    "code": "nba-regular-season"
  },
  "athlete": {
    "name": "LaMelo Ball"
  },
  "teamAtEvent": {
    "name": "Charlotte Hornets"
  },
  "season": "2023-24",
  "eventDate": "2023-11-26",
  "opponent": {
    "name": "Orlando Magic"
  },
  "injury": {
    "code": "ankle-sprain",
    "confirmedDiagnosis": "Right ankle strain.",
    "confirmationStatus": "confirmed"
  },
  "observedMechanismTags": ["unclear"],
  "isClassic": false,
  "classicReason": null,
  "classicProposedBy": null,
  "classicExceptionApprovedBy": null,
  "video": {
    "provider": "youtube",
    "contentType": "in-game-injury-event",
    "eventBinding": {
      "status": "verified",
      "eventSourceId": "src-nba-ankle-2023-008-event",
      "checkedBy": "Codex G3 authoring audit",
      "checkedAt": "2026-08-08T02:30:00Z",
      "basis": "PASS — Browser reopened the original event/video and first-party diagnosis pages. The combined visible title, date, event context, and first-party text matched LaMelo Ball, 2023-11-26, Charlotte Hornets vs. Orlando Magic, and nba-regular-season; the diagnosis explicitly supports “Right ankle strain.” No duplicate accepted event identity or canonical video URL was found, and no extra grade, mechanism, surgery, prognosis, rehabilitation, or return-to-play claim was inferred. The diagnosis page is distinct from the event/video page; only the diagnosis page is treated as diagnostic evidence."
    },
    "canonicalUrl": "https://www.youtube.com/watch?v=RDDGpqOvSdg",
    "uploaderName": "ESPN",
    "uploaderProvenance": "broadcaster-rightsholder",
    "embedStatus": "verified",
    "embedCheckedAt": "2026-08-08T11:16:32Z",
    "durationSeconds": 19,
    "startSeconds": 0,
    "endSeconds": 19,
    "fallbackUrl": "https://www.youtube.com/watch?v=RDDGpqOvSdg",
    "sourceProvenanceVerification": {
      "status": "verified",
      "verifiedBy": "Codex embed enrichment auditor",
      "verifiedAt": "2026-08-08T11:16:32Z",
      "basis": "PASS — watch metadata matched ESPN and the event date; the privacy-enhanced vertical iframe loaded without autoplay, started after user action, advanced playback and exposed a captions control.",
      "notes": "直式 Short 由 responsive player 容器呈現；不下載或重製縮圖。",
      "verifiedPolicyVersion": "nba-v2",
      "reviewedVideoIdentityDigest": "11cdb0328091bac7653344d0d7f73fc1c9243532310b986ff4ab2e17ddbf73c5"
    },
    "captionStatus": "available",
    "captionCheckedAt": "2026-08-08T11:16:32Z",
    "publicRightsReview": {
      "status": "not-requested",
      "reviewedBy": null,
      "reviewedAt": null,
      "reviewedVideoDigest": null,
      "policyVersion": null,
      "termsCheckedAt": null,
      "decisionBasis": null,
      "notes": null,
      "decisionPath": null,
      "decisionDigest": null
    },
    "segments": [
      {
        "startSeconds": 0,
        "endSeconds": 19,
        "observation": "ESPN Short 呈現 LaMelo Ball 在場上事件後由他人協助前往休息室；僅記錄可見事件序列。"
      }
    ]
  },
  "general": {
    "whatHappened": "LaMelo Ball 於 2023-11-26 代表 Charlotte Hornets 對 Orlando Magic 出賽；原始事件頁與診斷來源已分開記錄。",
    "whatIsVisible": "ESPN Short 呈現 LaMelo Ball 在場上事件後由他人協助前往休息室；僅記錄可見事件序列。",
    "whatVideoCannotProve": "這段影片不能單獨證明診斷、分級、側別以外的合併傷、影像結果、治療方式、預後或回場日期。",
    "confirmedUpdate": "NBA.com 的具名來源明載診斷：Right ankle strain."
  },
  "professional": {
    "mechanismAnalysis": "影片可描述踩到他人腳部、落地或足部翻轉等外觀；若角度或接觸點不清楚，應標示機轉不明。",
    "clinicalLimitations": "畫面不能分辨韌帶分級、骨折或高位踝損傷，仍須以症狀、觸診、負重能力與適當檢查評估。",
    "differentialContext": "急性腳踝事件的鑑別不只外側韌帶扭傷；若臨床疑慮存在，還需排除骨折、脛腓聯合與其他周邊組織損傷。",
    "treatmentAndRtpMeaning": "處置與回場應依疼痛、活動度、力量、平衡、信心與運動任務逐項評估，不能由新聞時程或影片單獨決定。",
    "claims": [
      {
        "id": "claim-lamelo-ball-ankle-sprain-2023-01",
        "field": "professional.mechanismAnalysis",
        "text": "影片可描述踩到他人腳部、落地或足部翻轉等外觀；若角度或接觸點不清楚，應標示機轉不明。",
        "evidenceIds": ["src-nba-ankle-2023-008-teaching-01"]
      },
      {
        "id": "claim-lamelo-ball-ankle-sprain-2023-02",
        "field": "professional.clinicalLimitations",
        "text": "畫面不能分辨韌帶分級、骨折或高位踝損傷，仍須以症狀、觸診、負重能力與適當檢查評估。",
        "evidenceIds": ["src-nba-ankle-2023-008-teaching-01"]
      },
      {
        "id": "claim-lamelo-ball-ankle-sprain-2023-03",
        "field": "professional.differentialContext",
        "text": "急性腳踝事件的鑑別不只外側韌帶扭傷；若臨床疑慮存在，還需排除骨折、脛腓聯合與其他周邊組織損傷。",
        "evidenceIds": ["src-nba-ankle-2023-008-teaching-01"]
      },
      {
        "id": "claim-lamelo-ball-ankle-sprain-2023-04",
        "field": "professional.treatmentAndRtpMeaning",
        "text": "處置與回場應依疼痛、活動度、力量、平衡、信心與運動任務逐項評估，不能由新聞時程或影片單獨決定。",
        "evidenceIds": ["src-nba-ankle-2023-008-teaching-01"]
      }
    ],
    "evidenceIds": ["src-nba-ankle-2023-008-teaching-01"],
    "rtpCourseKey": null
  },
  "sources": [
    {
      "id": "src-nba-ankle-2023-008-video",
      "type": "video-original",
      "title": "LaMelo Ball was helped to the locker room after suffering an apparent injury",
      "publisher": "ESPN",
      "independenceGroup": "espn",
      "originReportId": null,
      "url": "https://www.youtube.com/watch?v=RDDGpqOvSdg",
      "publishedAt": "2023-11-26",
      "accessedAt": "2026-08-08",
      "supports": [
        "general.whatHappened",
        "general.whatIsVisible",
        "video.segmentObservation"
      ]
    },
    {
      "id": "src-nba-ankle-2023-008-diagnosis-01",
      "type": "diagnosis-first-party",
      "title": "Hornets' LaMelo Ball carried off with ankle strain, misses rest of game vs. Magic",
      "publisher": "NBA.com",
      "independenceGroup": "nba",
      "originReportId": null,
      "url": "https://www.nba.com/news/hornets-lamelo-ball-out-right-ankle-strain",
      "publishedAt": "2023-11-27",
      "accessedAt": "2026-08-07",
      "supports": ["injury.confirmedDiagnosis", "general.confirmedUpdate"]
    },
    {
      "id": "src-nba-ankle-2023-008-event",
      "type": "event-context",
      "title": "LaMelo Ball leaves the game with a right ankle injury",
      "publisher": "NBA.com",
      "independenceGroup": "nba-com",
      "originReportId": null,
      "url": "https://www.nba.com/watch/video/lamelo-ball-leaves-the-game-with-a-right-leg-injury",
      "publishedAt": "2023-11-26",
      "accessedAt": "2026-08-07",
      "supports": ["general.whatHappened"]
    },
    {
      "id": "src-nba-ankle-2023-008-teaching-01",
      "type": "teaching-evidence",
      "title": "Ankle Stability and Movement Coordination Impairments: Lateral Ankle Ligament Sprains Revision 2021",
      "publisher": "Journal of Orthopaedic & Sports Physical Therapy",
      "independenceGroup": "journal-of-orthopaedic-sports-physical-therapy",
      "url": "https://pubmed.ncbi.nlm.nih.gov/33789434/",
      "publishedAt": "2021-04-01",
      "supports": [
        "professional.mechanismAnalysis",
        "professional.clinicalLimitations",
        "professional.differentialContext",
        "professional.treatmentAndRtpMeaning"
      ],
      "originReportId": null,
      "accessedAt": "2026-08-08"
    }
  ],
  "review": {
    "status": "approved",
    "reviewerName": "吳易澄醫師",
    "reviewerQualification": "復健科專科醫師",
    "reviewedAt": "2026-08-08T11:52:39Z",
    "reviewedContentDigest": "bf7d4d49e1d2eb40a53bc4ac06d3aee34d90e00bc646b7e3f398962b1e912242"
  },
  "audit": {
    "createdAt": "2026-08-08T02:30:00Z",
    "updatedAt": "2026-08-08T11:33:30Z",
    "sourceRecordId": "CAND-NBA-ANKLE-2023-008"
  }
}
