{
  "schemaVersion": 1,
  "id": "CASE-NBAACHILLES-2019-005",
  "slug": "kevin-durant-achilles-rupture-2019",
  "status": "medical-review",
  "sourceManifestBinding": {
    "candidateId": "CAND-NBA-ACHILLES-2019-005",
    "manifestId": "NBA-SOURCE-2026-08-08-001",
    "manifestDigest": "4a25692e27115b6ec16818a64dd6e85778360e4f00e2b3f6a288b4ca5f0ed0bc",
    "entryDigest": "f22491e605eb1767e67ed96ca93086c7112ebf966679e41b8facb8d4d20537ed",
    "sourceReviewDecisionDigest": "dd08a891325f384621f61af9dd14084de579a9b5b86ce2cccecff893827d8464",
    "sourcePolicyVersion": "nba-v2"
  },
  "sport": {
    "code": "basketball"
  },
  "league": {
    "code": "nba"
  },
  "competition": {
    "code": "nba-playoffs"
  },
  "athlete": {
    "name": "Kevin Durant"
  },
  "teamAtEvent": {
    "name": "Golden State Warriors"
  },
  "season": "2018-19",
  "eventDate": "2019-06-10",
  "opponent": {
    "name": "Toronto Raptors"
  },
  "injury": {
    "code": "achilles-rupture",
    "confirmedDiagnosis": "Ruptured right Achilles tendon.",
    "confirmationStatus": "confirmed"
  },
  "observedMechanismTags": ["unclear"],
  "isClassic": false,
  "classicReason": null,
  "classicProposedBy": null,
  "classicExceptionApprovedBy": null,
  "video": {
    "provider": "youtube",
    "contentType": "in-game-injury-event",
    "eventBinding": {
      "status": "verified",
      "eventSourceId": "src-nba-achilles-2019-005-event",
      "checkedBy": "Codex G3 authoring audit",
      "checkedAt": "2026-08-08T02:30:00Z",
      "basis": "PASS — Browser reopened the original event/video and first-party diagnosis pages. The combined visible title, date, event context, and first-party text matched Kevin Durant, 2019-06-10, Golden State Warriors vs. Toronto Raptors, and nba-playoffs; the diagnosis explicitly supports “Ruptured right Achilles tendon.” No duplicate accepted event identity or canonical video URL was found, and no extra grade, mechanism, surgery, prognosis, rehabilitation, or return-to-play claim was inferred. The diagnosis page is distinct from the event/video page; only the diagnosis page is treated as diagnostic evidence."
    },
    "canonicalUrl": "https://www.youtube.com/watch?v=YcSOLHMsJYw",
    "uploaderName": "ESPN",
    "uploaderProvenance": "broadcaster-rightsholder",
    "embedStatus": "verified",
    "embedCheckedAt": "2026-08-08T11:16:32Z",
    "durationSeconds": 155,
    "startSeconds": 0,
    "endSeconds": 155,
    "fallbackUrl": "https://www.youtube.com/watch?v=YcSOLHMsJYw",
    "sourceProvenanceVerification": {
      "status": "verified",
      "verifiedBy": "Codex embed enrichment auditor",
      "verifiedAt": "2026-08-08T11:16:32Z",
      "basis": "PASS — watch metadata matched ESPN and the event date; the privacy-enhanced iframe loaded without autoplay, started after user action, advanced playback and exposed a captions control.",
      "notes": "ESPN 原始頻道影片採 click-to-load privacy-enhanced player；不下載或重製媒體。",
      "verifiedPolicyVersion": "nba-v2",
      "reviewedVideoIdentityDigest": "ff223d9cca9620d9f54f6381b5cea4abb93f39b15089d103c9f9662c9dafdd7e"
    },
    "captionStatus": "available",
    "captionCheckedAt": "2026-08-08T11:16:32Z",
    "publicRightsReview": {
      "status": "not-requested",
      "reviewedBy": null,
      "reviewedAt": null,
      "reviewedVideoDigest": null,
      "policyVersion": null,
      "termsCheckedAt": null,
      "decisionBasis": null,
      "notes": null,
      "decisionPath": null,
      "decisionDigest": null
    },
    "segments": [
      {
        "startSeconds": 0,
        "endSeconds": 155,
        "observation": "ESPN 片段呈現 Kevin Durant 在總冠軍賽第五戰回到場上、右下肢事件後停止比賽並離場；不由畫面確認診斷。"
      }
    ]
  },
  "general": {
    "whatHappened": "Kevin Durant 於 2019-06-10 代表 Golden State Warriors 對 Toronto Raptors 出賽；原始事件頁與診斷來源已分開記錄。",
    "whatIsVisible": "ESPN 片段呈現 Kevin Durant 在總冠軍賽第五戰回到場上、右下肢事件後停止比賽並離場；不由畫面確認診斷。",
    "whatVideoCannotProve": "這段影片不能單獨證明診斷、分級、側別以外的合併傷、影像結果、治療方式、預後或回場日期。",
    "confirmedUpdate": "NBA.com 的具名來源明載診斷：Ruptured right Achilles tendon."
  },
  "professional": {
    "mechanismAnalysis": "影片可描述蹬地、加速、減速或非接觸下肢事件等外觀，但不能僅憑動作確認 Achilles tendon rupture。",
    "clinicalLimitations": "Achilles tendon rupture 的判定需要臨床評估，必要時搭配超音波等影像；影片不能確認斷裂位置、間隙或完整性。",
    "differentialContext": "急性小腿後側事件尚需與其他肌腱、肌肉或踝部病灶區分；本案例只採用具名來源明載的診斷。",
    "treatmentAndRtpMeaning": "急性 Achilles tendon rupture 可有手術或非手術路徑；選擇與功能復健、進階及回場都應個別化，不能套用單一時程。",
    "claims": [
      {
        "id": "claim-kevin-durant-achilles-rupture-2019-01",
        "field": "professional.mechanismAnalysis",
        "text": "影片可描述蹬地、加速、減速或非接觸下肢事件等外觀，但不能僅憑動作確認 Achilles tendon rupture。",
        "evidenceIds": ["src-nba-achilles-2019-005-teaching-01"]
      },
      {
        "id": "claim-kevin-durant-achilles-rupture-2019-02",
        "field": "professional.clinicalLimitations",
        "text": "Achilles tendon rupture 的判定需要臨床評估，必要時搭配超音波等影像；影片不能確認斷裂位置、間隙或完整性。",
        "evidenceIds": ["src-nba-achilles-2019-005-teaching-01"]
      },
      {
        "id": "claim-kevin-durant-achilles-rupture-2019-03",
        "field": "professional.differentialContext",
        "text": "急性小腿後側事件尚需與其他肌腱、肌肉或踝部病灶區分；本案例只採用具名來源明載的診斷。",
        "evidenceIds": ["src-nba-achilles-2019-005-teaching-01"]
      },
      {
        "id": "claim-kevin-durant-achilles-rupture-2019-04",
        "field": "professional.treatmentAndRtpMeaning",
        "text": "急性 Achilles tendon rupture 可有手術或非手術路徑；選擇與功能復健、進階及回場都應個別化，不能套用單一時程。",
        "evidenceIds": ["src-nba-achilles-2019-005-teaching-01"]
      }
    ],
    "evidenceIds": ["src-nba-achilles-2019-005-teaching-01"],
    "rtpCourseKey": null
  },
  "sources": [
    {
      "id": "src-nba-achilles-2019-005-video",
      "type": "video-original",
      "title": "Kevin Durant suffers Achilles injury after hot start, exits Game 5 | 2019 NBA Finals Highlights",
      "publisher": "ESPN",
      "independenceGroup": "espn",
      "originReportId": null,
      "url": "https://www.youtube.com/watch?v=YcSOLHMsJYw",
      "publishedAt": "2019-06-10",
      "accessedAt": "2026-08-08",
      "supports": [
        "general.whatHappened",
        "general.whatIsVisible",
        "video.segmentObservation"
      ]
    },
    {
      "id": "src-nba-achilles-2019-005-diagnosis-01",
      "type": "diagnosis-first-party",
      "title": "Kevin Durant confirms he suffered ruptured right Achilles",
      "publisher": "NBA.com",
      "independenceGroup": "nba",
      "originReportId": null,
      "url": "https://www.nba.com/news/warriors-durant-achilles-injury-update",
      "publishedAt": "2019-06-13",
      "accessedAt": "2026-08-07",
      "supports": ["injury.confirmedDiagnosis", "general.confirmedUpdate"]
    },
    {
      "id": "src-nba-achilles-2019-005-event",
      "type": "event-context",
      "title": "Kevin Durant leaves Game 5 with injury",
      "publisher": "NBA.com",
      "independenceGroup": "nba-com",
      "originReportId": null,
      "url": "https://www.nba.com/watch/video/kevin-durant-leaves-game-5-with-injury",
      "publishedAt": "2019-06-10",
      "accessedAt": "2026-08-07",
      "supports": ["general.whatHappened"]
    },
    {
      "id": "src-nba-achilles-2019-005-teaching-01",
      "type": "teaching-evidence",
      "title": "Position Statement: Management of Acute Achilles Ruptures",
      "publisher": "American Orthopaedic Foot & Ankle Society",
      "independenceGroup": "aofas",
      "url": "https://www.aofas.org/docs/default-source/research-and-policy/position-statements/positionstatement_acuteachillesruptures_nov2024.pdf",
      "publishedAt": "2024-11-19",
      "supports": [
        "professional.mechanismAnalysis",
        "professional.clinicalLimitations",
        "professional.differentialContext",
        "professional.treatmentAndRtpMeaning"
      ],
      "originReportId": null,
      "accessedAt": "2026-08-08"
    }
  ],
  "review": {
    "status": "in-review",
    "reviewerName": null,
    "reviewerQualification": null,
    "reviewedAt": null,
    "reviewedContentDigest": null
  },
  "audit": {
    "createdAt": "2026-08-08T02:30:00Z",
    "updatedAt": "2026-08-08T11:33:30Z",
    "sourceRecordId": "CAND-NBA-ACHILLES-2019-005"
  }
}
