{
  "schemaVersion": 1,
  "id": "CASE-NBAANKLE-2021-001",
  "slug": "trae-young-ankle-sprain-2021",
  "status": "medical-review",
  "sourceManifestBinding": {
    "candidateId": "CAND-NBA-ANKLE-2021-001",
    "manifestId": "NBA-SOURCE-2026-08-06-001",
    "manifestDigest": "8beedf3fcc0c7c498bf08ffb2fbc671759e7a61ed4e04f09afab579b6a86eb4d",
    "entryDigest": "cb2b83513cd89aa618916ac61700b97163b7b39fb0943f18e2d41dd6a16eed58",
    "sourceReviewDecisionDigest": "cd40d39d8c3463c0bb2cbdb1125a613cf1100d341bb8c6f4d59456462875ad0c",
    "sourcePolicyVersion": "nba-v2"
  },
  "sport": {
    "code": "basketball"
  },
  "league": {
    "code": "nba"
  },
  "competition": {
    "code": "nba-regular-season"
  },
  "athlete": {
    "name": "Trae Young"
  },
  "teamAtEvent": {
    "name": "Atlanta Hawks"
  },
  "season": "2020-21",
  "eventDate": "2021-04-21",
  "opponent": {
    "name": "New York Knicks"
  },
  "injury": {
    "code": "ankle-sprain",
    "confirmedDiagnosis": "Atlanta announced a left ankle sprain.",
    "confirmationStatus": "confirmed"
  },
  "observedMechanismTags": ["unclear"],
  "isClassic": false,
  "classicReason": null,
  "classicProposedBy": null,
  "classicExceptionApprovedBy": null,
  "video": {
    "provider": "nba",
    "contentType": "in-game-injury-event",
    "eventBinding": {
      "status": "verified",
      "eventSourceId": "src-nba-ankle-2021-001-event",
      "checkedBy": "Codex G3 authoring audit",
      "checkedAt": "2026-08-08T02:30:00Z",
      "basis": "PASS — Browser reopened the original event/video and first-party diagnosis pages. The combined visible title, date, event context, and first-party text matched Trae Young, 2021-04-21, Atlanta Hawks vs. New York Knicks, and nba-regular-season; the diagnosis explicitly supports “Atlanta announced a left ankle sprain.” No duplicate accepted event identity or canonical video URL was found, and no extra grade, mechanism, surgery, prognosis, rehabilitation, or return-to-play claim was inferred. The diagnosis page is distinct from the event/video page; only the diagnosis page is treated as diagnostic evidence."
    },
    "canonicalUrl": "https://www.nba.com/watch/video/traeinjuryvsknicks",
    "uploaderName": "NBA",
    "uploaderProvenance": "league",
    "embedStatus": "external-link-only",
    "embedCheckedAt": "2026-08-07T10:08:25Z",
    "durationSeconds": 44,
    "startSeconds": 0,
    "endSeconds": 44,
    "fallbackUrl": "https://www.nba.com/watch/video/traeinjuryvsknicks",
    "sourceProvenanceVerification": {
      "status": "verified",
      "verifiedBy": "Codex ankle-sprain researcher",
      "verifiedAt": "2026-08-07T10:08:25Z",
      "basis": "NBA-hosted original Watch page on the league official platform; NBA Watch channel page opened and matched.",
      "notes": "NBA 原頁播放器未提供可用字幕控制；以同一 canonical URL 作外連 fallback。",
      "verifiedPolicyVersion": "nba-v2",
      "reviewedVideoIdentityDigest": "7c86b5c14ab7ea278ee43994f594bdec909e6b42aff705f2f6b7e66b17bec58e"
    },
    "captionStatus": "unavailable",
    "captionCheckedAt": "2026-08-07T10:08:25Z",
    "publicRightsReview": {
      "status": "not-requested",
      "reviewedBy": null,
      "reviewedAt": null,
      "reviewedVideoDigest": null,
      "policyVersion": null,
      "termsCheckedAt": null,
      "decisionBasis": null,
      "notes": null,
      "decisionPath": null,
      "decisionDigest": null
    },
    "segments": [
      {
        "startSeconds": 0,
        "endSeconds": 44,
        "observation": "片段呈現 Trae Young 腳踝事件後倒地並由他人協助離場；不由畫面判定分級。"
      }
    ]
  },
  "general": {
    "whatHappened": "Trae Young 於 2021-04-21 代表 Atlanta Hawks 對 New York Knicks 出賽；原始事件頁與診斷來源已分開記錄。",
    "whatIsVisible": "片段呈現 Trae Young 腳踝事件後倒地並由他人協助離場；不由畫面判定分級。",
    "whatVideoCannotProve": "這段影片不能單獨證明診斷、分級、側別以外的合併傷、影像結果、治療方式、預後或回場日期。",
    "confirmedUpdate": "NBA.com 的具名來源明載診斷：Atlanta announced a left ankle sprain."
  },
  "professional": {
    "mechanismAnalysis": "影片可描述踩到他人腳部、落地或足部翻轉等外觀；若角度或接觸點不清楚，應標示機轉不明。",
    "clinicalLimitations": "畫面不能分辨韌帶分級、骨折或高位踝損傷，仍須以症狀、觸診、負重能力與適當檢查評估。",
    "differentialContext": "急性腳踝事件的鑑別不只外側韌帶扭傷；若臨床疑慮存在，還需排除骨折、脛腓聯合與其他周邊組織損傷。",
    "treatmentAndRtpMeaning": "處置與回場應依疼痛、活動度、力量、平衡、信心與運動任務逐項評估，不能由新聞時程或影片單獨決定。",
    "claims": [
      {
        "id": "claim-trae-young-ankle-sprain-2021-01",
        "field": "professional.mechanismAnalysis",
        "text": "影片可描述踩到他人腳部、落地或足部翻轉等外觀；若角度或接觸點不清楚，應標示機轉不明。",
        "evidenceIds": ["src-nba-ankle-2021-001-teaching-01"]
      },
      {
        "id": "claim-trae-young-ankle-sprain-2021-02",
        "field": "professional.clinicalLimitations",
        "text": "畫面不能分辨韌帶分級、骨折或高位踝損傷，仍須以症狀、觸診、負重能力與適當檢查評估。",
        "evidenceIds": ["src-nba-ankle-2021-001-teaching-01"]
      },
      {
        "id": "claim-trae-young-ankle-sprain-2021-03",
        "field": "professional.differentialContext",
        "text": "急性腳踝事件的鑑別不只外側韌帶扭傷；若臨床疑慮存在，還需排除骨折、脛腓聯合與其他周邊組織損傷。",
        "evidenceIds": ["src-nba-ankle-2021-001-teaching-01"]
      },
      {
        "id": "claim-trae-young-ankle-sprain-2021-04",
        "field": "professional.treatmentAndRtpMeaning",
        "text": "處置與回場應依疼痛、活動度、力量、平衡、信心與運動任務逐項評估，不能由新聞時程或影片單獨決定。",
        "evidenceIds": ["src-nba-ankle-2021-001-teaching-01"]
      }
    ],
    "evidenceIds": ["src-nba-ankle-2021-001-teaching-01"],
    "rtpCourseKey": null
  },
  "sources": [
    {
      "id": "src-nba-ankle-2021-001-video",
      "type": "video-original",
      "title": "Trae Young goes down with ankle injury, helped off court",
      "publisher": "NBA",
      "independenceGroup": "nba",
      "originReportId": null,
      "url": "https://www.nba.com/watch/video/traeinjuryvsknicks",
      "publishedAt": "2021-04-21",
      "accessedAt": "2026-08-07",
      "supports": [
        "general.whatHappened",
        "general.whatIsVisible",
        "video.segmentObservation"
      ]
    },
    {
      "id": "src-nba-ankle-2021-001-diagnosis-01",
      "type": "diagnosis-first-party",
      "title": "Hawks' Trae Young diagnosed with a lateral left ankle sprain",
      "publisher": "NBA.com",
      "independenceGroup": "nba",
      "originReportId": null,
      "url": "https://www.nba.com/news/report-trae-youngs-ankle-injury-not-considered-serious",
      "publishedAt": "2021-04-23",
      "accessedAt": "2026-08-07",
      "supports": ["injury.confirmedDiagnosis", "general.confirmedUpdate"]
    },
    {
      "id": "src-nba-ankle-2021-001-event",
      "type": "event-context",
      "title": "Trae Young goes down with ankle injury, helped off court",
      "publisher": "NBA",
      "independenceGroup": "nba",
      "originReportId": null,
      "url": "https://www.nba.com/watch/video/traeinjuryvsknicks",
      "publishedAt": "2021-04-21",
      "accessedAt": "2026-08-07",
      "supports": ["general.whatHappened"]
    },
    {
      "id": "src-nba-ankle-2021-001-teaching-01",
      "type": "teaching-evidence",
      "title": "Ankle Stability and Movement Coordination Impairments: Lateral Ankle Ligament Sprains Revision 2021",
      "publisher": "Journal of Orthopaedic & Sports Physical Therapy",
      "independenceGroup": "journal-of-orthopaedic-sports-physical-therapy",
      "url": "https://pubmed.ncbi.nlm.nih.gov/33789434/",
      "publishedAt": "2021-04-01",
      "supports": [
        "professional.mechanismAnalysis",
        "professional.clinicalLimitations",
        "professional.differentialContext",
        "professional.treatmentAndRtpMeaning"
      ],
      "originReportId": null,
      "accessedAt": "2026-08-08"
    }
  ],
  "review": {
    "status": "in-review",
    "reviewerName": null,
    "reviewerQualification": null,
    "reviewedAt": null,
    "reviewedContentDigest": null
  },
  "audit": {
    "createdAt": "2026-08-08T02:30:00Z",
    "updatedAt": "2026-08-08T02:30:00Z",
    "sourceRecordId": "CAND-NBA-ANKLE-2021-001"
  }
}
